[
  {
    "TargetHostname": "WORKSTATION001",
    "ApplicationName": "FixtureApp",
    "NetworkSharePath": "\\\\fileserver.example.internal\\software\\FixtureApp",
    "InstallerPath": "Tests/fixtures/deployment/fixture-installer.txt",
    "ExpectedSha256": "89b64039d9904d890325eecf24de28a64c1290fe1579aa69a562ead8561459d3",
    "SilentInstallArguments": "/quiet /norestart",
    "InstallDetectionMethod": "CommandExitCodeOnly",
    "InstallDetectionValue": "",
    "RebootRequired": false,
    "Owner": "Endpoint Engineering",
    "RequestReference": "REQ-FIXTURE-0001",
    "ChangeReference": "CHG-FIXTURE-0001",
    "TicketReference": "TICKET-FIXTURE-0001",
    "DeploymentGroup": "fixture",
    "Batch": "dry-run"
  }
]
